{
  "schemaVersion": "preprod-attestation-v1",
  "control": "worker-capacity",
  "environment": "REPLACE_WITH_PREPROD_ENVIRONMENT",
  "executedAt": "2000-01-01T00:00:00Z",
  "releaseCommit": "0000000000000000000000000000000000000000",
  "result": "failed",
  "operator": "REPLACE",
  "reviewer": "REPLACE_WITH_INDEPENDENT_REVIEWER",
  "secretRedactionVerified": true,
  "signedUrlRedactionVerified": true,
  "evidence": [
    {
      "targetMachineClass": "REPLACE",
      "workload": { "episodes": 10, "materials": 40, "concurrentRenders": 3 },
      "laneConfiguration": "REPLACE",
      "p95SecondsByLane": {},
      "peakMemoryBytes": null,
      "peakTemporaryDiskBytes": null,
      "backlogRecoverySeconds": null,
      "starvationObserved": true
    }
  ]
}
